{
  "spec_path": "/Users/dev/Developer/Swift-Gurus/solid-coder/.claude/specs/SPEC-001-solid-coder/features/SPEC-070-legacy-entrypoint-retirement/Spec.md",
  "applicable": true,
  "driver": "cohesion",
  "split_rationale": "The MCP group joins tool/ledger data with MCP integration and runtime lifecycle; the archive group joins instruction/ledger data with observation. Workflow preservation shares Legacy healthcheck integration and runtime lifecycle. Host-manifest and installation-evidence criteria are singleton groups under the strict two-kind rule. This is a retrospective evidence-organization proposal, so materializing five separate implementation specs may offer little value; it does not reopen completed retirement work or claim installation validation.",
  "parent_residue": {
    "description": "If adopted, this retrospective feature would index five evidence subtasks for reversible legacy entrypoint retirement. Keep the original high-level Connection and Flow diagrams here; partition the Sequence diagram: server initialization and unknown-tool interaction accompany the MCP candidate, and explicit archived prompt reads accompany the workflow candidate. The index has no own ACs or implementation TR; global scope exclusions are carried by the installation-evidence candidate and apply to every child. Preserve the original parent status and evidence limits; this proposal creates no Spec.md files.",
    "connects_to_kept": [
      {
        "direction": "depends on",
        "target": "SPEC-001",
        "how": "Narrows current entrypoints; historical implementation records are not erased."
      }
    ],
    "subtasks_table": [
      {
        "index": 1,
        "title": "Retained MCP runtime surface",
        "spec_placeholder": "SPEC-NNN-1",
        "scope": "US-1.1, US-1.2, US-3.1"
      },
      {
        "index": 2,
        "title": "Repository host manifest configuration",
        "spec_placeholder": "SPEC-NNN-2",
        "scope": "US-1.3"
      },
      {
        "index": 3,
        "title": "Retained workflow runtime behavior",
        "spec_placeholder": "SPEC-NNN-3",
        "scope": "US-1.4, US-3.2"
      },
      {
        "index": 4,
        "title": "Recoverable instruction discovery inventory",
        "spec_placeholder": "SPEC-NNN-4",
        "scope": "US-2.1, US-2.2, US-2.3"
      },
      {
        "index": 5,
        "title": "Global installation evidence boundary",
        "spec_placeholder": "SPEC-NNN-5",
        "scope": "US-3.3"
      }
    ]
  },
  "candidate_subtasks": [
    {
      "title": "Retained MCP runtime surface",
      "kind": "cohesion",
      "description": "Record the retained MCP descriptor and dispatch surface while preserving internal callables. This partitions evidence for completed checkout work and proposes no new implementation.",
      "user_story": {
        "id": "US-1",
        "narrative": "As a developer, I want only the MCP capabilities used by the retained workflows advertised so that clients stop selecting obsolete orchestration tools. As a maintainer, I want retirement to affect entrypoint exposure so that existing implementation remains available while the supported surface is reduced.",
        "acs": [
          {
            "source_id": "US-1.1",
            "text": "The configured docs, pipeline, flow-engine, and Apple servers advertise exactly the 18 retained tools listed in the retirement ledger, with retained descriptions, input/output schemas, and metadata identical to their pre-retirement descriptors."
          },
          {
            "source_id": "US-1.2",
            "text": "The four disabled docs tools and ten disabled pipeline tools listed in the ledger are absent from discovery and return an unknown-tool result when invoked through MCP."
          },
          {
            "source_id": "US-3.1",
            "text": "Disabling MCP exposure preserves the underlying decorated callables, handlers, scripts, and schemas; direct internal calls remain available, and an unrestricted registration policy continues to expose all supplied tools."
          }
        ]
      },
      "input_output": {
        "input": "Repository MCP host manifests, tool registrations, skill/agent entrypoints, and the retained capability inventory.",
        "output": "Four configured MCP servers advertising 18 tools; 11 discoverable skills and six plugin agents. Hosts read manifests at startup, discover instructions from active filenames, and retain the resulting descriptors for that host session."
      },
      "technical_requirements": [
        {
          "text": "Tool registration filters apply before both descriptor publication and dispatch registration.",
          "source": "parent TR paragraph 1, sentence 1 (split)"
        },
        {
          "text": "An omitted filter preserves prior registration behavior; an empty filter exposes no tools.",
          "source": "parent TR paragraph 1, sentence 2 (split)"
        },
        {
          "text": "Filtering must not replace decorated functions or prevent explicit internal invocation.",
          "source": "parent TR paragraph 1, sentence 3 (split)"
        }
      ],
      "connects_to": {
        "depends_on": [
          {
            "target": "Repository host manifests and registration policies",
            "how": "Select the active MCP surface during server construction."
          }
        ],
        "serves": [
          {
            "target": "Host sessions and legacy comparison harness",
            "how": "Sessions receive retained tools; the harness explicitly reads the archived prompt."
          }
        ]
      },
      "definition_of_done": [
        "Each acceptance criterion has a recorded evidence reference, with verification limits identified."
      ],
      "blocked_by": [],
      "estimated_size_band": "tiny",
      "rationale": "Partition uses original ACs and source-attributed TR sentences. Original Input/Output rows are quoted as interface context; candidate ownership is only its listed ACs. "
    },
    {
      "title": "Repository host manifest configuration",
      "kind": "cohesion",
      "description": "Record removal of specs server configuration from repository host manifests. Preserve explicit source and CLI use as required by the original criterion.",
      "user_story": {
        "id": "US-1",
        "narrative": "As a developer, I want only the MCP capabilities used by the retained workflows advertised so that clients stop selecting obsolete orchestration tools.",
        "acs": [
          {
            "source_id": "US-1.3",
            "text": "Neither repository host manifest configures the specs MCP server, while its source, CLI scripts, and gateway operations remain available for explicit use."
          }
        ]
      },
      "input_output": {
        "input": "Repository MCP host manifests, tool registrations, skill/agent entrypoints, and the retained capability inventory.",
        "output": "Four configured MCP servers advertising 18 tools; 11 discoverable skills and six plugin agents. Hosts read manifests at startup, discover instructions from active filenames, and retain the resulting descriptors for that host session."
      },
      "technical_requirements": [],
      "connects_to": {
        "depends_on": [
          {
            "target": "Repository host manifests and registration policies",
            "how": "Select the active MCP surface during server construction."
          }
        ],
        "serves": []
      },
      "definition_of_done": [
        "Each acceptance criterion has a recorded evidence reference, with verification limits identified."
      ],
      "blocked_by": [],
      "estimated_size_band": "tiny",
      "rationale": "Partition uses original ACs and source-attributed TR sentences. Original Input/Output rows are quoted as interface context; candidate ownership is only its listed ACs. No standalone mechanism TR in parent covers this manifest-only criterion."
    },
    {
      "title": "Retained workflow runtime behavior",
      "kind": "cohesion",
      "description": "Record continued operation of retained workflows and the comparison harness. Verify the harness explicitly reads the archived prompt and uses retained tool references.",
      "user_story": {
        "id": "US-1",
        "narrative": "As a developer, I want only the MCP capabilities used by the retained workflows advertised so that clients stop selecting obsolete orchestration tools. As a maintainer, I want retirement to affect entrypoint exposure so that existing implementation remains available while the supported surface is reduced.",
        "acs": [
          {
            "source_id": "US-1.4",
            "text": "Legacy healthcheck, workflow review, and the archived comparison harness reference only retained MCP capabilities; the harness can still construct its explicit legacy review prompt."
          },
          {
            "source_id": "US-3.2",
            "text": "Legacy healthcheck's native rules, flow-engine behavior, and the six Apple build/test/lint tool contracts remain unchanged by this retirement."
          }
        ]
      },
      "input_output": {
        "input": "Repository MCP host manifests, tool registrations, skill/agent entrypoints, and the retained capability inventory.",
        "output": "Four configured MCP servers advertising 18 tools; 11 discoverable skills and six plugin agents. Hosts read manifests at startup, discover instructions from active filenames, and retain the resulting descriptors for that host session."
      },
      "technical_requirements": [
        {
          "text": "The dedicated flow-engine and Apple registrations remain intact.",
          "source": "parent TR paragraph 1, sentence 4 (split)"
        },
        {